{
  "$schema": "https://json-schema.org/draft/2020-12/schema",
  "$id": "urn:openehr:cnf:schema:ixit:0.1.0",
  "title": "CNF 2.0 IXIT (implementation extra information for testing)",
  "description": "The SUT topology a runner drives: named instances (base URL + auth mode, credentials by env-var reference, never inline) plus the environment block. The default instance `sut` is required for every run.",
  "type": "object",
  "additionalProperties": false,
  "required": [
    "instances"
  ],
  "properties": {
    "instances": {
      "type": "object",
      "minProperties": 1,
      "propertyNames": {
        "pattern": "^[A-Za-z_][A-Za-z0-9_]*$"
      },
      "additionalProperties": {
        "type": "object",
        "additionalProperties": false,
        "required": [
          "base_url",
          "auth"
        ],
        "properties": {
          "base_url": {
            "type": "string",
            "minLength": 1
          },
          "auth": {
            "type": "object",
            "required": [
              "mode"
            ],
            "oneOf": [
              {
                "additionalProperties": false,
                "required": [
                  "mode"
                ],
                "properties": {
                  "mode": {
                    "const": "none"
                  }
                }
              },
              {
                "additionalProperties": false,
                "required": [
                  "mode",
                  "user_env",
                  "password_env"
                ],
                "properties": {
                  "mode": {
                    "const": "basic"
                  },
                  "user_env": {
                    "type": "string",
                    "minLength": 1
                  },
                  "password_env": {
                    "type": "string",
                    "minLength": 1
                  }
                }
              },
              {
                "additionalProperties": false,
                "required": [
                  "mode",
                  "token_env"
                ],
                "properties": {
                  "mode": {
                    "const": "bearer"
                  },
                  "token_env": {
                    "type": "string",
                    "minLength": 1
                  }
                }
              },
              {
                "additionalProperties": false,
                "required": [
                  "mode"
                ],
                "properties": {
                  "mode": {
                    "const": "bearer_mint"
                  },
                  "subject": {
                    "type": "string",
                    "minLength": 1
                  },
                  "roles": {
                    "type": "array",
                    "items": {
                      "type": "string",
                      "minLength": 1
                    }
                  },
                  "default_scopes": {
                    "type": "array",
                    "items": {
                      "type": "string"
                    }
                  }
                }
              }
            ]
          },
          "headers": {
            "type": "object",
            "additionalProperties": {
              "type": "string"
            }
          },
          "signing": {
            "description": "THIS instance's version-signing posture, when it differs from the party default (RM common master06 §Digital Signature: the mode is a deployment fact, and a deployment runs one). A party claiming both modes declares two deployments as two instances, each with its own block; every signature check resolves instance-first, party default second. Absent => the top-level `signing` applies.",
            "type": "object",
            "required": [
              "mode"
            ],
            "oneOf": [
              {
                "additionalProperties": false,
                "required": [
                  "mode",
                  "algorithm",
                  "encoding"
                ],
                "properties": {
                  "mode": {
                    "const": "digest"
                  },
                  "algorithm": {
                    "type": "string",
                    "minLength": 1
                  },
                  "encoding": {
                    "type": "string",
                    "minLength": 1
                  },
                  "prefix": {
                    "type": "string"
                  }
                }
              },
              {
                "additionalProperties": false,
                "required": [
                  "mode",
                  "public_key"
                ],
                "properties": {
                  "mode": {
                    "const": "pgp"
                  },
                  "public_key": {
                    "type": "string",
                    "minLength": 1
                  }
                }
              }
            ]
          },
          "terminology": {
            "description": "THIS instance's terminology posture, when it differs from the party default. The unresolvable-value-set branch is one switch per running deployment, so a party exercising both runs two deployments and declares each one's posture on its own instance — the same law the `signing` block follows. Absent => the top-level `terminology` applies.",
            "type": "object",
            "additionalProperties": false,
            "required": [
              "posture",
              "servers"
            ],
            "properties": {
              "posture": {
                "description": "What the deployment does with a bound value set it cannot resolve. BASE architecture_overview master12 §Binding Terminology Value-sets to Archetypes puts the query in an external terminology query server and never says what happens when it cannot be reached, so the branch is a deployment fact, not a spec rule (register AMB-172).",
                "enum": [
                  "fail_open",
                  "fail_closed"
                ]
              },
              "servers": {
                "description": "The terminology servers this deployment is wired to. A namespace is whatever key a case names for a terminology (code-system URI, value-set URL, terminology id); a DECLARED-unreachable server is how the terminology-server-down branch is exercised for the whole run, never by a mid-run reconfiguration.",
                "type": "array",
                "minItems": 1,
                "items": {
                  "type": "object",
                  "additionalProperties": false,
                  "required": [
                    "name",
                    "namespaces"
                  ],
                  "properties": {
                    "name": {
                      "type": "string",
                      "minLength": 1
                    },
                    "reachable": {
                      "type": "boolean"
                    },
                    "namespaces": {
                      "type": "array",
                      "minItems": 1,
                      "items": {
                        "type": "string",
                        "minLength": 1
                      }
                    }
                  }
                }
              }
            }
          },
          "spec_profile": {
            "description": "THIS instance's openEHR specification generation set, when it differs from the party default. One running deployment implements exactly one set, so a party claiming both runs two deployments and declares each one's set on its own instance — the same law the `signing` and `terminology` blocks follow. Absent => the top-level `spec_profile` applies.",
            "enum": [
              "stable",
              "development"
            ]
          },
          "administrative": {
            "description": "Whether this instance's principal holds administrative authorization (register AMB-228). SM master02-overview.adoc §Functional Style delegates access control to the implementation, so the posture is an IXIT declaration; a role-boundary case states the posture it needs in requires, and an undeclared or opposite declaration records it not-applicable with that citation. Absent => undeclared, never a default.",
            "type": "boolean"
          }
        }
      }
    },
    "environment": {
      "type": "object",
      "additionalProperties": false,
      "required": [
        "hardware_class",
        "cores",
        "memory_gb",
        "storage_class",
        "topology"
      ],
      "properties": {
        "exclusive_server": {
          "type": "boolean"
        },
        "hardware_class": {
          "type": "string",
          "minLength": 1
        },
        "cores": {
          "type": "integer",
          "minimum": 0
        },
        "memory_gb": {
          "type": "integer",
          "minimum": 0
        },
        "storage_class": {
          "type": "string",
          "minLength": 1
        },
        "topology": {
          "type": "string",
          "minLength": 1
        }
      }
    },
    "containers": {
      "type": "object",
      "additionalProperties": false,
      "required": [
        "sut",
        "db"
      ],
      "properties": {
        "sut": {
          "type": "string",
          "minLength": 1
        },
        "db": {
          "type": "string",
          "minLength": 1
        }
      }
    },
    "system_id": {
      "description": "The SUT's own configured system identifier — the value it stamps into AUDIT_DETAILS.system_id when the client supplies none (ITS-REST Requests_and_responses §openehr-version and openehr-audit-details) and into every OBJECT_VERSION_ID.creating_system_id it mints. Declared here because no released operation discloses it; absent => the cases reading ${ixit:system_id} are not-applicable with that citation.",
      "type": "string",
      "minLength": 1
    },
    "dump_location": {
      "description": "A location on the SUT's OWN file system the admin dump/load operations may write an archive to and read one back from (SM i_admin_dump_load.adoc export_ehrs(file_sys_loc)/load_ehrs(file_sys_loc), whose only declared error is file_not_writable). Declared here because which paths a deployment can write is a property of its image and mounts that no operation discloses; absent => the cases reading ${ixit:dump_location} are not-applicable with that citation.",
      "type": "string",
      "minLength": 1
    },
    "signing": {
      "description": "The party's DEFAULT version-signing posture (RM common master06 §Digital Signature). Present => the Signing capability is claimed and this block declares the mode every instance runs unless it declares its own. digest: self-describing plain digest (algorithm/encoding/prefix); pgp: openPGP verified against the public key.",
      "type": "object",
      "required": [
        "mode"
      ],
      "oneOf": [
        {
          "additionalProperties": false,
          "required": [
            "mode",
            "algorithm",
            "encoding"
          ],
          "properties": {
            "mode": {
              "const": "digest"
            },
            "algorithm": {
              "type": "string",
              "minLength": 1
            },
            "encoding": {
              "type": "string",
              "minLength": 1
            },
            "prefix": {
              "type": "string"
            }
          }
        },
        {
          "additionalProperties": false,
          "required": [
            "mode",
            "public_key"
          ],
          "properties": {
            "mode": {
              "const": "pgp"
            },
            "public_key": {
              "type": "string",
              "minLength": 1
            }
          }
        }
      ]
    },
    "terminology": {
      "description": "The party's DEFAULT terminology posture: the terminology query servers this deployment is wired to (BASE architecture_overview master12 §Binding Terminology Value-sets to Archetypes — the bound value set is resolved by a server outside the CDR), which namespaces each answers for, and the unresolvable-value-set branch it realizes. Declared here because released ITS-REST 1.1.0 surfaces no terminology resource, so nothing on the wire discloses any of it; absent => every terminology-dependent case is not-applicable with that citation.",
      "type": "object",
      "additionalProperties": false,
      "required": [
        "posture",
        "servers"
      ],
      "properties": {
        "posture": {
          "description": "What the deployment does with a bound value set it cannot resolve. BASE architecture_overview master12 §Binding Terminology Value-sets to Archetypes puts the query in an external terminology query server and never says what happens when it cannot be reached, so the branch is a deployment fact, not a spec rule (register AMB-172).",
          "enum": [
            "fail_open",
            "fail_closed"
          ]
        },
        "servers": {
          "description": "The terminology servers this deployment is wired to. A namespace is whatever key a case names for a terminology (code-system URI, value-set URL, terminology id); a DECLARED-unreachable server is how the terminology-server-down branch is exercised for the whole run, never by a mid-run reconfiguration.",
          "type": "array",
          "minItems": 1,
          "items": {
            "type": "object",
            "additionalProperties": false,
            "required": [
              "name",
              "namespaces"
            ],
            "properties": {
              "name": {
                "type": "string",
                "minLength": 1
              },
              "reachable": {
                "type": "boolean"
              },
              "namespaces": {
                "type": "array",
                "minItems": 1,
                "items": {
                  "type": "string",
                  "minLength": 1
                }
              }
            }
          }
        }
      }
    },
    "spec_profile": {
      "description": "The party's DEFAULT openEHR specification generation set: `stable` = the latest RELEASED generations, `development` = the development generations, which admit surface no release defines yet. Declared here because no released operation discloses which set a deployment runs (the openEHR release strategy makes a minor release a compatible superset, so the sets differ only in accepted surface); absent => every case whose expectation rests on a generation set is not-applicable with that citation. An instance may override it.",
      "enum": [
        "stable",
        "development"
      ]
    },
    "smart": {
      "description": "The party's SMART App Launch lane (ITS-REST docs/smart_app_launch). Present => the deployment runs the CDR's SMART resource-server role and trusts the declared static test issuer, so the runner may mint per-step scoped access tokens (the CDR never issues them — master06 §Supported Authentication Flows makes that the Authorization Server's duty, and the conformance stack runs none). Absent => every SMART case is not-applicable with that citation.",
      "type": "object",
      "additionalProperties": false,
      "required": [
        "platform_instance",
        "mint"
      ],
      "properties": {
        "platform_instance": {
          "description": "The instance whose base_url is the SMART Platform base URL — master04 §Service Discovery serves /.well-known/smart-configuration relative to it, not to the openEHR REST base the other instances address.",
          "type": "string",
          "pattern": "^[A-Za-z_][A-Za-z0-9_]*$"
        },
        "mint": {
          "description": "The static test issuer the `bearer_mint` instances sign RS256 access tokens with. Committed test material, never production key material.",
          "type": "object",
          "additionalProperties": false,
          "required": [
            "issuer",
            "subject",
            "key_file",
            "kid",
            "ttl_seconds"
          ],
          "properties": {
            "issuer": {
              "type": "string",
              "minLength": 1
            },
            "audience": {
              "type": "string",
              "minLength": 1
            },
            "subject": {
              "type": "string",
              "minLength": 1
            },
            "roles": {
              "type": "array",
              "items": {
                "type": "string",
                "minLength": 1
              }
            },
            "key_file": {
              "type": "string",
              "minLength": 1
            },
            "kid": {
              "type": "string",
              "minLength": 1
            },
            "ttl_seconds": {
              "type": "integer",
              "minimum": 1
            }
          }
        }
      }
    }
  }
}
