{
  "instances": {
    "sut": {
      "base_url": "http://localhost:8080/openehr/v1",
      "auth": {
        "mode": "bearer_mint",
        "subject": "cnf-user",
        "roles": [
          "USER"
        ],
        "default_scopes": [
          "user/template-*.cruds",
          "user/aql-*.cruds"
        ]
      }
    },
    "admin": {
      "base_url": "http://localhost:8080/openehr/v1",
      "auth": {
        "mode": "bearer_mint",
        "subject": "cnf-admin",
        "roles": [
          "ADMIN",
          "USER"
        ],
        "default_scopes": [
          "user/template-*.cruds",
          "user/aql-*.cruds"
        ]
      }
    },
    "readonly": {
      "base_url": "http://localhost:8080/openehr/v1",
      "auth": {
        "mode": "bearer_mint",
        "subject": "cnf-readonly",
        "roles": [
          "READONLY"
        ],
        "default_scopes": [
          "user/template-*.r",
          "user/aql-*.r"
        ]
      }
    },
    "unauthenticated": {
      "base_url": "http://localhost:8080/openehr/v1",
      "auth": {
        "mode": "none"
      }
    },
    "smart_app": {
      "base_url": "http://localhost:8080/openehr/v1",
      "auth": {
        "mode": "bearer_mint"
      }
    },
    "smart_platform": {
      "base_url": "http://localhost:8080/rest",
      "auth": {
        "mode": "none"
      }
    },
    "sut_pgp": {
      "base_url": "http://localhost:8081/openehr/v1",
      "auth": {
        "mode": "bearer_mint",
        "subject": "cnf-user",
        "roles": [
          "USER"
        ],
        "default_scopes": [
          "user/template-*.cruds",
          "user/aql-*.cruds"
        ]
      },
      "terminology": {
        "posture": "fail_closed",
        "servers": [
          {
            "name": "sct",
            "reachable": false,
            "namespaces": [
              "cnf-sct-shaped",
              "http://cnf.example.test/fhir/CodeSystem/sct-shaped",
              "http://cnf.example.test/fhir/ValueSet/sct-shaped-disorders"
            ]
          },
          {
            "name": "loinc",
            "reachable": false,
            "namespaces": [
              "cnf-lab-shaped",
              "http://cnf.example.test/fhir/CodeSystem/lab-shaped",
              "http://cnf.example.test/fhir/ValueSet/lab-shaped-vitals"
            ]
          },
          {
            "name": "unreachable",
            "reachable": false,
            "namespaces": [
              "cnf-ts-down",
              "http://cnf.example.test/fhir/CodeSystem/ts-down",
              "http://cnf.example.test/fhir/ValueSet/ts-down-set"
            ]
          }
        ]
      },
      "signing": {
        "mode": "pgp",
        "public_key": "-----BEGIN PGP PUBLIC KEY BLOCK-----\n\nmQGNBGpjdiQBDACjsXWAnjphk8iBxgtX5eHkJow+w9uE8og3SjbrO8iXI3BDvlwT\nP+o8TpPx2a3w8qmS2DYHOh+OnKNb7MrvEV9xTTERuoQEIDIMpQkPs2RLVKwL3efd\nrz999e6gmcPrzTzgvS1nUxEwTAogh2lV0n/DwHahGVpb6Zw0HgOE1M1MQj/5tVdM\nApK79Vq1JNUkiWSsXHighs4W75Dp78Ku3+hpjINaTSVqcBCjhX81+qW5S0/E6gYh\nN6buNukWEgnQ33NaGHHRI5pTc3/xAQUXMW9E+iE9YNNffSM/MKmZgTLZt6kzz1Zf\ntLZglHTR4432pioHFVbyutxjyR4TID2V++DBcNc1vOst1DwRUDiFzhAdFglrvDD5\nFkwoZ6Lo+j1NtVXPBSO3gCbgorMwbSdaq1eUENHg1q+Q/KcsldDSR1d64pvBrUke\nfQ/DNZN9dz/GyGlilcZl6AKrNEVXTfmKYCX3Xm8tTKVt5mrqRS91qMLmoBKquEJV\nLaOin9Co1F93QHUAEQEAAbQ8Q05GIFRlc3QgVmVyc2lvbiBTaWduaW5nIDxjbmYt\nc2lnbmluZ0B0ZXN0LmVocmJhc2UtcnMubG9jYWw+iQHuBBMBCABYFiEEyH7vlPuC\nfQ9WS1XfMEgll4RU/QYFAmpjdiQbFIAAAAAABAAObWFudTIsMi41KzEuMTIsMCwz\nAxsvBAULCQgHAgIiAgYVCgkICwIEFgIDAQIeBwIXgAAKCRAwSCWXhFT9BgJbC/wJ\nM2QGP+DWk0GVUkxkVf0EvNc2fYDwdy6msKJxuj/LMjI6XNt6u0+irwT9ExVvtabT\naRGXzgxurkGL5fqyncvxFTevzTntN+znW1E4WxJiHma8Ifdhu8NxTfwqrURM/mH3\nnY4EbwjYNOszfwWpdg0dQCRa4PbbixfvU1TRLsA7UJQXdiYJncWmJ9AiajQrYMT4\nFdqyC5JuakXdG3bYxmsNBNC8vQfhmMFIOOuhFlnSnDdcSWqrQR2IUNose1CFf+gI\nfUQQEr3W+Gtbex70ajIyY1eZohZu7orGr4l1fEszT2wC7N6MKfGI7vhteTMBEQ7v\ng5pjDhkKdlLdXHvZOdIjo+XWRkLehJXUic0/eFdWQaJvvznc2IexVWu4g295/gon\n/nZBkYvosYtaaeKH1vht+O6ijYzaui39KYJN08tjBJYx2cXmZoBro9Uv5x4BIrMQ\n+wYmG/3UQLFX12Om+gH5N9AoFKoeR0gjyDESP4tELErjrBGhfZi7cgsqCVHF+hK5\nAY0EamN2JAEMAN0ESmqqFGw8773PigelIaa7Kski7VIPt61SpNB4sqLQhT/6h11l\n9MN512NrCobN3ydrta0vG4oeOHds8ZLV1oFdtNgwBxqi+wn6RxEna0SImcxZqElb\nNu3CyyYTf+npvY93cy8cxQlN68zaRSgMZ3Rzwo7Ibes7FlfBCDL+4jKKVf3wuWi7\nBkV0OhuFrfosnLDyOMqbVi9128zBIbBKG9ehPnccbhaKQvdUocwzVNHknNu+pDrm\n9bW9jAT0TbYQ+TrU6ragD8r8xreLItcptqK9nsonTrj8W+vt2FHlwDll6p30Dpd1\nNbckdRqXiibbPMn/lbSmCFdAiqPkO7x+sfipizjehRbXglX99zBPbDLBoaJkZYxD\nYrALEAbQC7/04PAkLn+M2g5kSxNeFO/D71L5WNwPZfR0EvpN/CLwLYU4qgGg3AFF\nCNXXH0/h6GSlI0CL2/XHt5kodnYQ0SMXsXMsYkIxM+GE3MSj5/3pYCFUIIcHBvMA\n+cfChQlc/suwewARAQABiQOIBBgBCAA8FiEEyH7vlPuCfQ9WS1XfMEgll4RU/QYF\nAmpjdiQbFIAAAAAABAAObWFudTIsMi41KzEuMTIsMCwzAhsCAcAJEDBIJZeEVP0G\nwPQgBBkBCAAdFiEEN2xE3ibp8n8OJrlPmz1tUqhEp8IFAmpjdiQACgkQmz1tUqhE\np8JAhAv/dlEDAKAHHoi7zyJAuk+ZD0NVleTYCM3lSyxqvSueAe2glg1wCMMSh9Ad\nBPJlEhWgmyPXgQo9VlrMPxhpXclMTbWmHY25zT6OxoRVhrhpFtvpPDR4RZlNYApU\nw0NrS+GW9rHYxlIaHPIIIse/YWGwmK0sgUTU86yTUru5HpJLG5MU4azjm6xwx0/W\n03IHab+xVHpYHMCOLpfJHdQrpDV1m1PCARB1h5GHE8vGs9E8I8aVf7oiF7lWEpGL\ncvBr2EOb5vn8Vo1BRo7zA52EUJiDrTn8Hu1vbEyvDYyUPG966wacIEge9G6RoiDB\nXrSzP0ZCmFcyIGLjQK0tWyjXzVL8cZjOy7KARZqFpla2M1QFi9r5y9hnUyfZeY2l\nGdfLFzCUh3vXrEXt08S0mNJ5ZX3E6QjGzqSKVvEmvLJASG9owzj8ISibqyQtBVGo\n/he1RsGClFEpn62g98+pM8YfeQFQuI0W0XJ7proC0celNEzfYXeBuWrLIbo5W/ev\nT3gVkaQr9sYL/RaDxw4uJsUcLslXqVWdSktJiymNunaPir81z4OrymDcBFfS/isK\naMiZHyprY49N10Y/jTDX4tIUFPSdCwwY+je0iPA/RRIKtt1FYj4YKXa0iR0cxfMz\ng82mTENIXbRu/F1iGJut9675PjfH0lrWhXoaIU2q1BKV3FJZcBIgMvFHcL/7X1qN\nQ6fxdLUzPdzv61ejwlm/s9FX3oOYC7pMWB/o14ygtb7VQ+4S4GKgq055P/JLib4A\nYRWN7rSO66VlMP1ixolmxA/8c8lqu+sSezg3Zr1UNnf33apiMxJpiP6cfgOSRqr6\nU9dtcwUn/wj89zosKwebp8u26CgNDX40RIyz8a7fOUTuFDm+ijyUZz4qhuz/joop\nUzV86JtvZC2A7I9kbTlF+3gInzQlCo8tC6APC4f2P9aGbTRgi7ZpUs8iQh1lmOA3\nxE6UNZKithOqKHOI7nCRfLVNy10YZ40llc887CxP0BlFcGyQkDI5FaySQ+KBTwzT\nUl42iCvwkc0I2w==\n=4HuR\n-----END PGP PUBLIC KEY BLOCK-----\n"
      }
    },
    "sut_stable": {
      "base_url": "http://localhost:8082/openehr/v1",
      "auth": {
        "mode": "bearer_mint",
        "subject": "cnf-user",
        "roles": [
          "USER"
        ],
        "default_scopes": [
          "user/template-*.cruds",
          "user/aql-*.cruds"
        ]
      },
      "spec_profile": "stable"
    }
  },
  "containers": {
    "sut": "veredictum-fixture-sut-1",
    "db": "veredictum-fixture-db-1"
  },
  "spec_profile": "development",
  "system_id": "fixture.local",
  "dump_location": "/tmp/openehr-cnf/dump",
  "signing": {
    "mode": "digest",
    "algorithm": "sha256",
    "encoding": "base64",
    "prefix": "sha256:"
  },
  "terminology": {
    "posture": "fail_open",
    "servers": [
      {
        "name": "sct",
        "namespaces": [
          "cnf-sct-shaped",
          "http://cnf.example.test/fhir/CodeSystem/sct-shaped",
          "http://cnf.example.test/fhir/ValueSet/sct-shaped-disorders"
        ]
      },
      {
        "name": "loinc",
        "namespaces": [
          "cnf-lab-shaped",
          "http://cnf.example.test/fhir/CodeSystem/lab-shaped",
          "http://cnf.example.test/fhir/ValueSet/lab-shaped-vitals"
        ]
      },
      {
        "name": "unreachable",
        "reachable": false,
        "namespaces": [
          "cnf-ts-down",
          "http://cnf.example.test/fhir/CodeSystem/ts-down",
          "http://cnf.example.test/fhir/ValueSet/ts-down-set"
        ]
      }
    ]
  },
  "environment": {
    "exclusive_server": true,
    "hardware_class": "consumer-laptop",
    "cores": 8,
    "memory_gb": 16,
    "storage_class": "nvme",
    "topology": "FIXTURE: a three-instance single-node deployment description, carried so the declaration exercises every ixit block the runner reads (the primary instance, an openPGP version-signing instance on 8081, and a stable-generation instance on 8082). No such deployment exists and nothing composes it."
  },
  "smart": {
    "platform_instance": "smart_platform",
    "mint": {
      "issuer": "https://as.cnf.test",
      "audience": "cnf-smart-sut",
      "subject": "cnf-smart-app",
      "roles": [
        "USER"
      ],
      "key_file": "../smart-test-issuer/cnf-smart-test.key.pem",
      "kid": "cnf-smart-test",
      "ttl_seconds": 300
    }
  }
}
